id,create_at,updated_at,name,price,description,thumbnail_image_url,type_id
1,2022-01-01 00:00:00,2022-01-01 00:00:00,울 혼방 더블 페이스 하이넥 스웨터,19900.00,울의 느낌을 살리면서 폴리에스터와 이중 편직하여 적당한 두께감과 탄력성이 있습니다.,http://image.mujikorea.net/goods/31/13/74/25/AAC07A0A_COL_525_130.jpg,1
2,2022-01-01 00:00:00,2022-01-01 00:00:00,울 혼방 더블 페이스 재킷,29900.00,울의 느낌을 살리면서 폴리에스터와 이중 편직하여 적당한 두께감과 탄력성이 있습니다.,http://image.mujikorea.net/goods/31/12/71/93/M9AA032_COL_201_130.jpg,1
3,2022-01-01 00:00:00,2022-01-01 00:00:00,울 혼방 더블 페이스 하이넥 스웨터,19900.00,울의 느낌을 살리면서 폴리에스터와 이중 편직하여 적당한 두께감과 탄력성이 있습니다.,http://image.mujikorea.net/goods/31/12/71/92/M9AA031_COL_22_130.jpg,1
4,2022-01-01 00:00:00,2022-01-01 00:00:00,튼튼한 니트 원단 집업 가디건,19900.00,"굵기가 다른 두올의 실을 꼬아 편직했습니다. 가볍고 부드러우며 거친 표면감이 특징입니다.
",http://image.mujikorea.net/goods/31/12/71/17/M9AA030_COL_213_130.jpg,1
5,2022-01-01 00:00:00,2022-01-01 00:00:00,메리노 울 미들 게이지 베스트,29900.00,"울의 느낌을 살리면서 폴리에스터와 이중 편직하여 적당한 두께감과 탄력성이 있습니다.
",http://image.mujikorea.net/goods/31/14/23/26/AAH01A1A_COL_851_130.jpg,1
